Header,Date,Description,Link
Check if you need a UK visa,none,"You may need a visa to come to the UK to visit, study or work.","=HYPERLINK(""https://www.gov.uk/check-uk-visa"",""more details"")"
Living in Nigeria,none,"Advice for British people living in Nigeria, including information on health, education, benefits, residence requirements and more. ","=HYPERLINK(""https://www.gov.uk/guidance/living-in-nigeria"",""more details"")"
Nigeria travel advice,none,"Latest travel advice for Nigeria including safety and security, entry requirements, travel warnings and health","=HYPERLINK(""https://www.gov.uk/foreign-travel-advice/nigeria"",""more details"")"
DFID management response to ICAI recommendations on DFID education project in Nigeria.,  9 May 2013 ,DFID response to Independent Commission for Aid Impact recommendations on DFID education project in Nigeria,"=HYPERLINK(""https://www.gov.uk/government/publications/dfid-management-response-to-icai-recommendations-on-dfid-education-project-in-nigeria"",""more details"")"
DFID management response to the ICAI recommendations on DFID's education programmes in Nigeria progress update March 2013,  2 April 2013 ,Progress update March 2013 on the DFID management response to the (ICAI) recommendations on DFID's education programmes in Nigeria.,"=HYPERLINK(""https://www.gov.uk/government/publications/dfid-management-response-to-the-independent-commission-for-aid-impact-icai-recommendations-on-dfids-education-programmes-in-nigeria-progress-report"",""more details"")"
Gender in Nigeria Report 2012, 14 August 2012 ,This report provides a comprehensive view of gender in Nigeria.,"=HYPERLINK(""https://www.gov.uk/government/publications/gender-in-nigeria-report-2012"",""more details"")"
Gender in Nigeria Report 2012 - Summary, 14 August 2012 ,This report provides a summary of gender in Nigeria. ,"=HYPERLINK(""https://www.gov.uk/government/publications/gender-in-nigeria-report-2012-summary"",""more details"")"
Department for International Development, DFID ,"The home of Department for International Development on GOV.UK. The Department for International Development (DFID) leads the UK’s work to end extreme poverty, building a safer, healthier, more prosperous world for all of us…","=HYPERLINK(""https://www.gov.uk/government/organisations/department-for-international-development"",""more details"")"
"Education, horizontal inequalities and ethnic relations in Nigeria.",  1 January 2007 ,,"=HYPERLINK(""https://www.gov.uk/dfid-research-outputs/education-horizontal-inequalities-and-ethnic-relations-in-nigeria"",""more details"")"
"Islamic education, religious elites and the state in Kano, Nigeria. Summary paper.",  1 January 2009 ,,"=HYPERLINK(""https://www.gov.uk/dfid-research-outputs/islamic-education-religious-elites-and-the-state-in-kano-nigeria-summary-paper"",""more details"")"
"Accountability and Performance of Government Agencies in the Delivery of Water, Education and Road Services in Nigeria",  1 January 2012 ,,"=HYPERLINK(""https://www.gov.uk/dfid-research-outputs/accountability-and-performance-of-government-agencies-in-the-delivery-of-water-education-and-road-services-in-nigeria"",""more details"")"
Global School Partnerships local authority grants,none,The grants are designed to create international relationships that can broker and support partnerships focused on global education.,"=HYPERLINK(""https://www.gov.uk/guidance/global-school-partnerships-local-authority-grants"",""more details"")"
"Transformative Education in Violent Contexts: Working with Muslim and Christian Youth in Kaduna, Nigeria",  1 January 2009 ,,"=HYPERLINK(""https://www.gov.uk/dfid-research-outputs/transformative-education-in-violent-contexts-working-with-muslim-and-christian-youth-in-kaduna-nigeria"",""more details"")"
Christian Rogg,none,"Christian Rogg joined DFID as a Private Sector Advisor in 1999 and subsequently led the Growth Team in DFID’s Policy Division in London before taking up leadership positions in DFID’s offices in Nigeria, Vietnam and Ghana. He started his career in banking in Germany and also worked…","=HYPERLINK(""https://www.gov.uk/government/people/christian-rogg"",""more details"")"
Nigeria - Country case study update, 16 October 2014 ,A country case study update on Nigeria which forms part or the 2013 Human Rights and Democracy Report.,"=HYPERLINK(""https://www.gov.uk/government/case-studies/nigeria-country-case-study-update"",""more details"")"
"Islamic education, the state and madrasa reform: lessons from South Asia and Nigeria. Policy Brief.",  1 January 2010 ,,"=HYPERLINK(""https://www.gov.uk/dfid-research-outputs/islamic-education-the-state-and-madrasa-reform-lessons-from-south-asia-and-nigeria-policy-brief"",""more details"")"
Country case study: Nigeria – the response to terrorism, 10 April 2014 ,A country case study on the response to terrorism in Nigeria from the 2013 Human Rights and Democracy Report. ,"=HYPERLINK(""https://www.gov.uk/government/case-studies/country-case-study-nigeria-the-response-to-terrorism"",""more details"")"
Exporting to Nigeria, 28 March 2014 ,A guide for British businesses who are interested in developing their overseas trade and doing business in Nigeria.,"=HYPERLINK(""https://www.gov.uk/government/publications/exporting-to-nigeria"",""more details"")"
MDGs in focus - MDG 2: Achieve universal primary education, 13 September 2010 ,Find out how a DFID funded project is helping to get more girls into schools in Nigeria.,"=HYPERLINK(""https://www.gov.uk/government/case-studies/mdgs-in-focus-mdg-2-achieve-universal-primary-education"",""more details"")"
Minister Wharton emphasises Britain’s support in Nigeria,  5 September 2016 ,International Development Minister James Wharton has returned from his first visit to Nigeria.,"=HYPERLINK(""https://www.gov.uk/government/news/minister-wharton-emphasises-britains-support-in-nigeria"",""more details"")"
Header,Date,Description,Link
Politics and the Dilemma of Meaningful Access to Education: The Nigerian Story,  1 January 2011 ,,"=HYPERLINK(""https://www.gov.uk/dfid-research-outputs/politics-and-the-dilemma-of-meaningful-access-to-education-the-nigerian-story"",""more details"")"
"MDGs in focus – MDG 6: Combat HIV, AIDS, malaria and other diseases",  3 August 2010 ,Find out how DFID is helping to tackle malaria in Nigeria,"=HYPERLINK(""https://www.gov.uk/government/case-studies/mdgs-in-focus-mdg-6-combat-hiv-aids-malaria-and-other-diseases"",""more details"")"
Immigration Rules: Immigration Rules Appendix V: visitor rules, Manual section ,Immigration Rules for visitors. ,"=HYPERLINK(""https://www.gov.uk/guidance/immigration-rules/immigration-rules-appendix-v-visitor-rules"",""more details"")"
London Ministerial on security in Nigeria: communique, 12 June 2014 ,"
                  First published during the 2010 to 2015 Conservative and Liberal Democrat coalition government
                ","=HYPERLINK(""https://www.gov.uk/government/publications/london-ministerial-on-security-in-nigeria-communique"",""more details"")"
Overseas Business Risk - Nigeria, 29 January 2016 ,Conclusions from the London Ministerial on security in Nigeria.,"=HYPERLINK(""https://www.gov.uk/government/publications/overseas-business-risk-nigeria"",""more details"")"
Communications company helped to expand overseas, 22 April 2013 ,Information on key security and political risks which UK businesses may face when operating in Nigeria.,"=HYPERLINK(""https://www.gov.uk/government/case-studies/communications-company-helped-to-expand-overseas"",""more details"")"
Arthur Snell,none,"UK Trade & Investment’s Defence & Security Organisation played a crucial role helping ARL Comms expand overseas, starting with Africa.","=HYPERLINK(""https://www.gov.uk/government/people/arthur-snell"",""more details"")"
Philip Tissot,none,"Arthur Snell was born in the south-east of England and educated at Oxford University, where he studied History. After graduating with First Class Honours he joined the Foreign and Commonwealth office. After an initial spell on the Iraq desk in London, Arthur was appointed Second…","=HYPERLINK(""https://www.gov.uk/government/people/philip-tissot"",""more details"")"
Teacher motivation and incentives in Nigeria,  1 January 2005 ,"…), British Consulate-General, Toronto, Canada 1986-1988: Desk Officer Aid for Trade, Aid Policy Department, Overseas Development Administration., London 1983-1986: Accountant and later Vice-Consul British High Commission, Lagos, Nigeria 1981-1983: Africa and Middle East Floater (short…","=HYPERLINK(""https://www.gov.uk/dfid-research-outputs/teacher-motivation-and-incentives-in-nigeria"",""more details"")"
"Ethnic Structure, Inequality and Governance of the Public Sector in Nigeria.",  1 January 2005 ,,"=HYPERLINK(""https://www.gov.uk/dfid-research-outputs/ethnic-structure-inequality-and-governance-of-the-public-sector-in-nigeria"",""more details"")"
Joint Information Activities Group (JIAG),none,,"=HYPERLINK(""https://www.gov.uk/guidance/the-defence-media-operations-centre-dmoc"",""more details"")"
Helpdesk Report: Higher Education Reform,  1 January 2014 ,"The JIAG provides specialist Information activities training, operational delivery capability and capacity building for defence, and other government departments.","=HYPERLINK(""https://www.gov.uk/dfid-research-outputs/helpdesk-report-higher-education-reform"",""more details"")"
"Religion, Politics and Governance in Nigeria",  1 January 2009 ,,"=HYPERLINK(""https://www.gov.uk/dfid-research-outputs/religion-politics-and-governance-in-nigeria"",""more details"")"
Helpdesk Report: Reproductive Health Commodity Security Country Case study: Nigeria,  1 January 2005 ,,"=HYPERLINK(""https://www.gov.uk/dfid-research-outputs/helpdesk-report-reproductive-health-commodity-security-country-case-study-nigeria"",""more details"")"
Multidimensional Poverty in Nigeria: First Order Dominance Approach,  1 January 2014 ,,"=HYPERLINK(""https://www.gov.uk/dfid-research-outputs/multidimensional-poverty-in-nigeria-first-order-dominance-approach"",""more details"")"
Planning and managing meaningful access to education: the Nigerian experience.,  1 January 2010 ,,"=HYPERLINK(""https://www.gov.uk/dfid-research-outputs/planning-and-managing-meaningful-access-to-education-the-nigerian-experience"",""more details"")"
Gender Equity in Commonwealth Higher Education: An Examination of Sustainable Interventions in Selected Commonwealth Universities. Researching the Issues 65,  1 January 2006 ,,"=HYPERLINK(""https://www.gov.uk/dfid-research-outputs/gender-equity-in-commonwealth-higher-education-an-examination-of-sustainable-interventions-in-selected-commonwealth-universities-researching-the-issues-65"",""more details"")"
Maintaining Universal Primary Education: Lessons from Commonwealth Africa,  1 January 2009 ,,"=HYPERLINK(""https://www.gov.uk/dfid-research-outputs/maintaining-universal-primary-education-lessons-from-commonwealth-africa"",""more details"")"
DFID Results Framework results 2011 to 2015 by sector, 25 July 2016 ,,"=HYPERLINK(""https://www.gov.uk/government/publications/dfid-results-framework-results-2011-to-2015-by-sector"",""more details"")"
Country Study Report - Nigeria.,  1 January 2005 ,This page provides the individual sector breakdowns of our 2011-2015 DRF results.,"=HYPERLINK(""https://www.gov.uk/dfid-research-outputs/country-study-report-nigeria"",""more details"")"
Header,Date,Description,Link
Teacher Education at a Distance: Impact on Development in the Community,  1 January 2006 ,,"=HYPERLINK(""https://www.gov.uk/dfid-research-outputs/teacher-education-at-a-distance-impact-on-development-in-the-community"",""more details"")"
"Prostate Cancer Awareness, Knowledge, and Screening Practices among Older Men in Oyo State, Nigeria",  1 January 2010 ,,"=HYPERLINK(""https://www.gov.uk/dfid-research-outputs/prostate-cancer-awareness-knowledge-and-screening-practices-among-older-men-in-oyo-state-nigeria"",""more details"")"
Parental Education and Children’s Educational Access Over Time: Evidence from Six African Countries,  1 January 2010 ,,"=HYPERLINK(""https://www.gov.uk/dfid-research-outputs/parental-education-and-children-s-educational-access-over-time-evidence-from-six-african-countries"",""more details"")"
Politics of access to education: the Nigerian story. [CREATE annual lecture],  1 January 2010 ,,"=HYPERLINK(""https://www.gov.uk/dfid-research-outputs/politics-of-access-to-education-the-nigerian-story-create-annual-lecture"",""more details"")"
The Role of Maternal Education During Educational Expansion for Children in Sub-Saharan Africa,  1 January 2011 ,,"=HYPERLINK(""https://www.gov.uk/dfid-research-outputs/the-role-of-maternal-education-during-educational-expansion-for-children-in-sub-saharan-africa"",""more details"")"
Comparative Trends in Ethno-Regional Inequalities in Ghana and Nigeria: Evidence from Demographic and Health Surveys.,  1 January 2009 ,,"=HYPERLINK(""https://www.gov.uk/dfid-research-outputs/comparative-trends-in-ethno-regional-inequalities-in-ghana-and-nigeria-evidence-from-demographic-and-health-surveys"",""more details"")"
"Determinants of Adoption of Improved Cassava Varieties among Farming Households in Oyo, Benue, and Akwa Ibom States of Nigeria. HarvestPlus Working Paper 20",  1 January 2015 ,,"=HYPERLINK(""https://www.gov.uk/dfid-research-outputs/determinants-of-adoption-of-improved-cassava-varieties-among-farming-households-in-oyo-benue-and-akwa-ibom-states-of-nigeria-harvestplus-working-paper-20"",""more details"")"
Knowledge dissemination and evaluation in a cervical cancer screening implementation program in Nigeria,  1 January 2007 ,,"=HYPERLINK(""https://www.gov.uk/dfid-research-outputs/knowledge-dissemination-and-evaluation-in-a-cervical-cancer-screening-implementation-program-in-nigeria"",""more details"")"
Application of Information and Communications Technology to the improvement of primary education in Oji River Local Government Area.,  1 January 2005 ,,"=HYPERLINK(""https://www.gov.uk/dfid-research-outputs/application-of-information-and-communications-technology-to-the-improvement-of-primary-education-in-oji-river-local-government-area"",""more details"")"
Reducing the cost of technical and vocational education,  1 January 1993 ,,"=HYPERLINK(""https://www.gov.uk/dfid-research-outputs/reducing-the-cost-of-technical-and-vocational-education"",""more details"")"
"Engaged yet Disengaged: Islamic Schools and the State in Kano, Nigeria.",  1 January 2009 ,,"=HYPERLINK(""https://www.gov.uk/dfid-research-outputs/engaged-yet-disengaged-islamic-schools-and-the-state-in-kano-nigeria"",""more details"")"
Role of Brokerage in Evolving Innovation Systems: A Case of the Fodder Innovation Project in Nigeria,  1 January 2011 ,,"=HYPERLINK(""https://www.gov.uk/dfid-research-outputs/role-of-brokerage-in-evolving-innovation-systems-a-case-of-the-fodder-innovation-project-in-nigeria"",""more details"")"
Prime Minister urges international action to stamp out modern slavery, 20 September 2016 ,Theresa May encourages international leaders and organisations to work together to stamp out modern slavery worldwide.,"=HYPERLINK(""https://www.gov.uk/government/news/pm-calls-for-global-action-to-stamp-out-modern-slavery"",""more details"")"
Department for International Development – About us,  2 June 2016 ,"The Department for International Development (DFID) leads the UK’s work to end extreme poverty, building a safer, healthier, more prosperous world for all of us which is firmly in the UK’s national interest. We're ending the…","=HYPERLINK(""https://www.gov.uk/government/organisations/department-for-international-development/about"",""more details"")"
Governance and Transparency Fund (GTF),none,The GTF was a one-off fund. All funding decisions have been taken and there are currently no plans to issue any further calls for proposals.,"=HYPERLINK(""https://www.gov.uk/guidance/governance-and-transparency-fund-gtf"",""more details"")"
Helpdesk Report: Education for pregnant girls and young mothers,  1 January 2015 ,,"=HYPERLINK(""https://www.gov.uk/dfid-research-outputs/helpdesk-report-education-for-pregnant-girls-and-young-mothers"",""more details"")"
Policy Transfer & Guideposts for Accountability for Complex Education Reforms,  1 January 2015 ,,"=HYPERLINK(""https://www.gov.uk/dfid-research-outputs/policy-transfer-guideposts-for-accountability-for-complex-education-reforms"",""more details"")"
School Choice in Lagos State,  1 January 2013 ,,"=HYPERLINK(""https://www.gov.uk/dfid-research-outputs/school-choice-in-lagos-state"",""more details"")"
Who Gets What? Is Improved Access to Basic Education Pro-Poor in SSA?,  1 January 2009 ,,"=HYPERLINK(""https://www.gov.uk/dfid-research-outputs/who-gets-what-is-improved-access-to-basic-education-pro-poor-in-ssa"",""more details"")"
Helpdesk Report: International Health Partnership (IHP+) Country Health Sector Teams: Background Literature Review,  1 January 2008 ,,"=HYPERLINK(""https://www.gov.uk/dfid-research-outputs/helpdesk-report-international-health-partnership-ihp-country-health-sector-teams-background-literature-review"",""more details"")"
Header,Date,Description,Link
In Service for Teacher Development in Sub-Saharan Africa - A Review of Literature Published between 1983-1997,  1 January 1999 ,,"=HYPERLINK(""https://www.gov.uk/dfid-research-outputs/in-service-for-teacher-development-in-sub-saharan-africa-a-review-of-literature-published-between-1983-1997"",""more details"")"
Willingness to pay for community-based health insurance in Nigeria: do economic status and place of residence matter?,  1 January 2010 ,,"=HYPERLINK(""https://www.gov.uk/dfid-research-outputs/willingness-to-pay-for-community-based-health-insurance-in-nigeria-do-economic-status-and-place-of-residence-matter"",""more details"")"
DFID Research: Agriculture on-air, 21 May 2009 ,"Recorded by Africans for Africans, the AGFAX radio service provides the latest information on agricultural and rural development","=HYPERLINK(""https://www.gov.uk/government/case-studies/dfid-research-agriculture-on-air"",""more details"")"
Home-Based Sexuality Education: Nigerian Parents Discussing Sex With Their Children.,  1 January 2008 ,,"=HYPERLINK(""https://www.gov.uk/dfid-research-outputs/home-based-sexuality-education-nigerian-parents-discussing-sex-with-their-children"",""more details"")"
Helpdesk Report: Girls' Education in Islamic Countries,  1 January 2011 ,,"=HYPERLINK(""https://www.gov.uk/dfid-research-outputs/helpdesk-report-girls-education-in-islamic-countries"",""more details"")"
Changing Patterns of Access to Education in Anglophone and Francophone Countries in Sub Saharan Africa: Is Education for All Pro-Poor?,  1 January 2011 ,,"=HYPERLINK(""https://www.gov.uk/dfid-research-outputs/changing-patterns-of-access-to-education-in-anglophone-and-francophone-countries-in-sub-saharan-africa-is-education-for-all-pro-poor"",""more details"")"
"Effects of training programme on HIV/AIDS prevention among primary health care workers in Oyo State, Nigeria",  1 January 2008 ,,"=HYPERLINK(""https://www.gov.uk/dfid-research-outputs/effects-of-training-programme-on-hiv-aids-prevention-among-primary-health-care-workers-in-oyo-state-nigeria"",""more details"")"
Spanning citizenship spaces through transnational coalitions: the Global Campaign for Education.,  1 January 2010 ,,"=HYPERLINK(""https://www.gov.uk/dfid-research-outputs/spanning-citizenship-spaces-through-transnational-coalitions-the-global-campaign-for-education"",""more details"")"
Prime Minister pledges new UK support to help tackle migration crisis, 21 September 2016 ,"The Prime Minister has announced how the UK is tackling some of the drivers of mass migration with new humanitarian funding to help address poverty, insecurity and conflict. ","=HYPERLINK(""https://www.gov.uk/government/news/prime-minister-pledges-new-uk-support-to-help-tackle-migration-crisis"",""more details"")"
Launch of  Alumni Awards 2017 in Thailand, 14 September 2016 ,The British Embassy and the British Council have launched the first year of three prestigious awards celebrating the UK alumni in Thailand. ,"=HYPERLINK(""https://www.gov.uk/government/world-location-news/launch-of-alumni-awards-2017-in-thailand"",""more details"")"
DFID Annual Report and Accounts 2014-15 Results, 16 July 2015 ,These pages provide an overview of progress against DFID’s Results Framework.  ,"=HYPERLINK(""https://www.gov.uk/government/publications/dfid-annual-report-and-accounts-2014-15-results"",""more details"")"
Knowledge and Utilization of Cervical Cancer Screening Services among Nigerian Students,  1 January 2009 ,,"=HYPERLINK(""https://www.gov.uk/dfid-research-outputs/knowledge-and-utilization-of-cervical-cancer-screening-services-among-nigerian-students"",""more details"")"
"Using ""Mother Trainers"" for Malaria Control: The Nigerian Experience",  1 January 2007 ,,"=HYPERLINK(""https://www.gov.uk/dfid-research-outputs/using-mother-trainers-for-malaria-control-the-nigerian-experience"",""more details"")"
Helpdesk Report: Evidence Base for Local Block Grants in Health,  1 January 2012 ,,"=HYPERLINK(""https://www.gov.uk/dfid-research-outputs/helpdesk-report-evidence-base-for-local-block-grants-in-health"",""more details"")"
Risks and Benefits of Multiple Sexual Partnerships: Beliefs of Rural Nigerian Adolescent Males.,  1 January 2007 ,,"=HYPERLINK(""https://www.gov.uk/dfid-research-outputs/risks-and-benefits-of-multiple-sexual-partnerships-beliefs-of-rural-nigerian-adolescent-males"",""more details"")"
Representations of Sexual Abstinence Among Rural Nigerian Adolescent Males.,  1 January 2007 ,,"=HYPERLINK(""https://www.gov.uk/dfid-research-outputs/representations-of-sexual-abstinence-among-rural-nigerian-adolescent-males"",""more details"")"
Baroness Anelay visits Nigeria, 11 February 2016 ,Foreign Office Minister Baroness Anelay visited Nigeria to hold discussions on the protection of civilians in the fight against Boko Haram,"=HYPERLINK(""https://www.gov.uk/government/news/baroness-anelay-visits-nigeria"",""more details"")"
Teacher Motivation in Sub-Saharan Africa and South Asia. Researching the Issues 71,  1 January 2007 ,,"=HYPERLINK(""https://www.gov.uk/dfid-research-outputs/teacher-motivation-in-sub-saharan-africa-and-south-asia-researching-the-issues-71"",""more details"")"
A time for change: ending female genital mutilation, 22 March 2013 ,"UK aid backs global wave of change to end damaging practice within a generation
","=HYPERLINK(""https://www.gov.uk/government/case-studies/a-time-for-change-ending-female-genital-mutilation"",""more details"")"
Adam Smith International signs £8 million agreement with MCC,  5 February 2015 ,UK government helped Adam Smith International win contracts in the aid-funded sector with Millennium Challenge Corporation (MCC) and USAid.,"=HYPERLINK(""https://www.gov.uk/government/case-studies/adam-smith-international-signs-8-million-agreement-with-mcc"",""more details"")"
Header,Date,Description,Link
DFID Research Strategy 2008-2013. Consultation Exercise - Africa. Executive Summary.,  1 January 2007 ,,"=HYPERLINK(""https://www.gov.uk/dfid-research-outputs/dfid-research-strategy-2008-2013-consultation-exercise-africa-executive-summary"",""more details"")"
DT14401 - Nigeria: Admissible and inadmissible taxes, 19 May 2016 ,,"=HYPERLINK(""https://www.gov.uk/hmrc-internal-manuals/double-taxation-relief/dt14401"",""more details"")"
Pro-poor national budgets (GSDRC Helpdesk Research Report 1202),  1 January 2015 ,,"=HYPERLINK(""https://www.gov.uk/dfid-research-outputs/pro-poor-national-budgets-gsdrc-helpdesk-research-report-1202"",""more details"")"
School Choice in Lagos State - Final Summary Report,  1 January 2014 ,,"=HYPERLINK(""https://www.gov.uk/dfid-research-outputs/school-choice-in-lagos-state-final-summary-report"",""more details"")"
Greening: Education can secure a peaceful future in Nigeria, 12 June 2014 ,"
                  First published during the 2010 to 2015 Conservative and Liberal Democrat coalition government
                ","=HYPERLINK(""https://www.gov.uk/government/news/greening-education-can-secure-a-peaceful-future-in-nigeria"",""more details"")"
UK's continued support to Nigeria in the fight against Boko Haram, 14 April 2016 ,Britain and the US have today pledged to educate a million girls and boys in northern Nigeria to boost development across the country.,"=HYPERLINK(""https://www.gov.uk/government/news/uks-continued-support-to-nigeria-in-the-fight-against-boko-haram"",""more details"")"
‘I think a woman who travels a lot is befriending other men and that's why she travels’: mobility constraints and their implications for rural women and girls in sub-Saharan Africa,  1 January 2011 ,The UK is fully committed to supporting Nigeria in its fight against Boko Haram and to helping find those abducted.,"=HYPERLINK(""https://www.gov.uk/dfid-research-outputs/i-think-a-woman-who-travels-a-lot-is-befriending-other-men-and-that-s-why-she-travels-mobility-constraints-and-their-implications-for-rural-women-and-girls-in-sub-saharan-africa"",""more details"")"
Minister of State for Foreign Affairs visits Nigeria,  9 February 2016 ,,"=HYPERLINK(""https://www.gov.uk/government/world-location-news/minister-of-state-for-foreign-affairs-visits-nigeria"",""more details"")"
FCO and DFID Press Release: UK committed to supporting Nigeria in the fight against Boko Haram, 14 April 2016 ,The British Minister of State for Foreign Affairs is visiting Nigeria to highlight the importance of protecting civilians in the fight against Boko Haram as well as preventing sexual violence in conflict,"=HYPERLINK(""https://www.gov.uk/government/world-location-news/fco-and-dfid-press-release-uk-committed-to-supporting-nigeria-in-the-fight-against-boko-haram"",""more details"")"
